{
    "behavior": "implementation_detail",
    "expected": {
        "value": {
            "bit60_set": true,
            "bit61_set": true,
            "bit62_set": true,
            "solid_map_dec": "17293822569102704640",
            "solid_map_hex": "0xF000000000000000",
            "x": 100,
            "y": 100
        }
    },
    "id": "map_value_lookup_003_get_solid_map",
    "inputs": [],
    "kind": "value_lookup",
    "map": {
        "generator": "flat",
        "ground_z": 62
    },
    "protocol_version": "0.75",
    "seed": 42,
    "subsystem": "map",
    "version": "1.1.0"
}
