{
    "behavior": "implementation_detail",
    "expected": {
        "ticks": [
            {
                "airborne": true,
                "orientation": {
                    "x": 1.0,
                    "y": 0.0,
                    "z": 0.0
                },
                "player_id": 0,
                "position": {
                    "x": 256.0,
                    "y": 256.0,
                    "z": 59.5
                },
                "tick": 0,
                "velocity": {
                    "x": 0.0,
                    "y": 0.0,
                    "z": -0.33770492672920227
                },
                "wade": false
            },
            {
                "airborne": true,
                "orientation": {
                    "x": 1.0,
                    "y": 0.0,
                    "z": 0.0
                },
                "player_id": 0,
                "position": {
                    "x": 256.0,
                    "y": 256.0,
                    "z": 59.33158493041992
                },
                "tick": 1,
                "velocity": {
                    "x": 0.0,
                    "y": 0.0,
                    "z": -0.3157753348350525
                },
                "wade": false
            },
            {
                "airborne": true,
                "orientation": {
                    "x": 1.0,
                    "y": 0.0,
                    "z": 0.0
                },
                "player_id": 0,
                "position": {
                    "x": 256.0,
                    "y": 256.0,
                    "z": 59.17467498779297
                },
                "tick": 2,
                "velocity": {
                    "x": 0.0,
                    "y": 0.0,
                    "z": -0.2942052483558655
                },
                "wade": false
            }
        ]
    },
    "id": "phys_jump_001",
    "inputs": [],
    "kind": "step_trace",
    "map": {
        "generator": "flat",
        "ground_z": 62
    },
    "protocol_version": "0.75",
    "seed": 42,
    "subsystem": "phys",
    "version": "1.1.0"
}
