{
    "behavior": "implementation_detail",
    "expected": {
        "ticks": [
            {
                "exploded": false,
                "fuse_s": 0.0833333358168602,
                "position": {
                    "x": 256.5533447265625,
                    "y": 256.5,
                    "z": 40.008888244628906
                },
                "tick": 0,
                "velocity": {
                    "x": 0.10000000149011612,
                    "y": 0.0,
                    "z": 0.01666666753590107
                }
            },
            {
                "exploded": false,
                "fuse_s": 0.06666667014360428,
                "position": {
                    "x": 256.606689453125,
                    "y": 256.5,
                    "z": 40.02666473388672
                },
                "tick": 1,
                "velocity": {
                    "x": 0.10000000149011612,
                    "y": 0.0,
                    "z": 0.03333333507180214
                }
            },
            {
                "exploded": false,
                "fuse_s": 0.05000000447034836,
                "position": {
                    "x": 256.6600341796875,
                    "y": 256.5,
                    "z": 40.0533332824707
                },
                "tick": 2,
                "velocity": {
                    "x": 0.10000000149011612,
                    "y": 0.0,
                    "z": 0.05000000447034836
                }
            },
            {
                "exploded": false,
                "fuse_s": 0.03333333879709244,
                "position": {
                    "x": 256.71337890625,
                    "y": 256.5,
                    "z": 40.088890075683594
                },
                "tick": 3,
                "velocity": {
                    "x": 0.10000000149011612,
                    "y": 0.0,
                    "z": 0.06666667014360428
                }
            },
            {
                "exploded": false,
                "fuse_s": 0.016666671261191368,
                "position": {
                    "x": 256.7667236328125,
                    "y": 256.5,
                    "z": 40.13333511352539
                },
                "tick": 4,
                "velocity": {
                    "x": 0.10000000149011612,
                    "y": 0.0,
                    "z": 0.0833333358168602
                }
            },
            {
                "exploded": false,
                "fuse_s": 3.725290298461914e-09,
                "position": {
                    "x": 256.820068359375,
                    "y": 256.5,
                    "z": 40.186668395996094
                },
                "tick": 5,
                "velocity": {
                    "x": 0.10000000149011612,
                    "y": 0.0,
                    "z": 0.10000000149011612
                }
            },
            {
                "exploded": true,
                "fuse_s": -0.01666666381061077,
                "position": {
                    "x": 256.820068359375,
                    "y": 256.5,
                    "z": 40.186668395996094
                },
                "tick": 6,
                "velocity": {
                    "x": 0.10000000149011612,
                    "y": 0.0,
                    "z": 0.10000000149011612
                }
            }
        ]
    },
    "id": "weap_step_trace_grenade_fuse",
    "inputs": [],
    "kind": "step_trace",
    "map": {
        "generator": "flat",
        "ground_z": 62
    },
    "protocol_version": "0.75",
    "seed": 42,
    "subsystem": "weap",
    "version": "1.1.0"
}
