{
    "behavior": "implementation_detail",
    "expected": {
        "value": {
            "hit": false,
            "maxSteps": 50,
            "ray_dx": 0.0,
            "ray_dy": 0.0,
            "ray_dz": -1.0,
            "ray_ox": 100.5,
            "ray_oy": 100.5,
            "ray_oz": 30.5,
            "startSolid": false
        }
    },
    "id": "map_value_lookup_007_raycast_miss",
    "inputs": [],
    "kind": "value_lookup",
    "map": {
        "generator": "flat",
        "ground_z": 62
    },
    "protocol_version": "0.75",
    "seed": 42,
    "subsystem": "map",
    "version": "1.1.0"
}
