{
    "behavior": "implementation_detail",
    "expected": {
        "value": {
            "callback_count": 1,
            "callbacks": [
                {
                    "cells": [
                        [
                            20,
                            20,
                            60
                        ]
                    ]
                }
            ],
            "destroyed_z": 61,
            "floating_z": 60,
            "pillar_x": 20,
            "pillar_y": 20
        }
    },
    "id": "map_value_lookup_017_cluster_connected",
    "inputs": [],
    "kind": "value_lookup",
    "map": {
        "generator": "flat",
        "ground_z": 62
    },
    "protocol_version": "0.75",
    "seed": 42,
    "subsystem": "map",
    "version": "1.1.0"
}
